{"anomalies":[],"away":{"behinds":10,"club_id":"demo_b","goals":10,"name":"Demo Club B","score":70},"fetched_at":"2026-09-12T12:30:00Z","final":true,"home":{"behinds":11,"club_id":"demo_a","goals":11,"name":"Demo Club A","score":77},"match_id":"demo:2026:qf1:a-b:replay","players":[{"name":"Demo Player A1","player_id":"legacy:demo_player_a1","stats":{"disposals":10,"handballs":4,"kicks":6}}],"quarter":"final","reads":["DEMO deterministic read: leading by a demo margin."],"reliable_fields":["disposals","kicks","handballs"],"source_game_id":"demo-live-final","status":"final","timeline":[{"away_score":16,"event":"DEMO quarter break","home_score":20,"quarter":"q1"},{"away_score":null,"event":"DEMO snapshot","home_score":null,"quarter":"q2"}],"unavailable_fields":["goals","behinds","clangers"]}
