{"anomalies":["DEMO anomaly: unnamed column ignored"],"away":{"behinds":4,"club_id":"demo_c","goals":2,"name":"Demo Club C","score":16},"fetched_at":"2026-09-24T23:50:00Z","final":false,"home":{"behinds":2,"club_id":"demo_a","goals":3,"name":"Demo Club A","score":20},"match_id":"demo:2026:r05:a-c","players":[{"name":"Demo Player A1","player_id":"legacy:demo_player_a1","stats":{"disposals":10,"handballs":4,"kicks":6}}],"quarter":"q2","reads":["DEMO deterministic read: leading by a demo margin."],"reliable_fields":["disposals","kicks","handballs"],"source_game_id":"demo-live-progress","status":"in_progress","timeline":[{"away_score":16,"event":"DEMO quarter break","home_score":20,"quarter":"q1"},{"away_score":null,"event":"DEMO snapshot","home_score":null,"quarter":"q2"}],"unavailable_fields":["goals","behinds","clangers"]}
